{
  "schema_version": "water-storm-ensemble-plan/v0.1",
  "classification": "synthetic_public",
  "benchmark_id": "water-storm-ensemble-001",
  "claim_ceiling": "SyntheticScenarioEnvelopeOnly",
  "source_input": {
    "path": "sol-atlas-core/fixtures/water-engineering/s0_stormwater.inp",
    "sha256": "b5b23a932990c3ea40d152ba100a6b3634790471160ca8d8c4ecc3099459101c",
    "byte_length": 1660,
    "synthetic": true
  },
  "solver_profile": {
    "engine": "EPA_SWMM",
    "engine_version": "5.2.4",
    "source_commit": "7952ca837988b1c32f791812eccc9fd64547e093",
    "flow_units": "CMS",
    "routing": "DYNWAVE",
    "rain_gauge": "G1",
    "rain_series": "RAIN1",
    "target_conduit_id": "C1",
    "baseline_diameter_m": 0.6,
    "simulation_start": "2020-01-01T00:00:00",
    "simulation_end": "2020-01-01T02:00:00",
    "rainfall_interval_minutes": 5,
    "rainfall_interval_count": 6
  },
  "rainfall_profiles": [
    {
      "profile_id": "reference",
      "interval_weights_mm_hr": [
        0,
        20,
        60,
        60,
        30,
        0
      ],
      "reference_depth_mm": 14.166667,
      "rationale": "Current S0 pulse shape; reference for this synthetic ensemble."
    },
    {
      "profile_id": "short_burst",
      "interval_weights_mm_hr": [
        0,
        0,
        85,
        85,
        0,
        0
      ],
      "reference_depth_mm": 14.166667,
      "rationale": "Same nominal depth concentrated into two 5-minute intervals."
    },
    {
      "profile_id": "early_peak",
      "interval_weights_mm_hr": [
        85,
        85,
        0,
        0,
        0,
        0
      ],
      "reference_depth_mm": 14.166667,
      "rationale": "Same nominal depth concentrated at the start of the event."
    },
    {
      "profile_id": "delayed_peak",
      "interval_weights_mm_hr": [
        0,
        0,
        0,
        0,
        85,
        85
      ],
      "reference_depth_mm": 14.166667,
      "rationale": "Same nominal depth concentrated late in the 30-minute event window."
    },
    {
      "profile_id": "double_peak",
      "interval_weights_mm_hr": [
        0,
        85,
        0,
        0,
        85,
        0
      ],
      "reference_depth_mm": 14.166667,
      "rationale": "Two separated rainfall pulses, with the same nominal depth."
    },
    {
      "profile_id": "sustained_moderate",
      "interval_weights_mm_hr": [
        28,
        28,
        28,
        28,
        29,
        29
      ],
      "reference_depth_mm": 14.166667,
      "rationale": "Near-uniform rainfall across all six 5-minute intervals."
    }
  ],
  "rainfall_depth_multipliers": [
    0.5,
    1,
    1.5
  ],
  "conduit_diameters_m": [
    0.6,
    0.4,
    0.25
  ],
  "cases": [
    {
      "case_id": "S1-REF-X050-D060",
      "rainfall_profile_id": "reference",
      "rainfall_depth_multiplier": 0.5,
      "rainfall_intensity_mm_hr": [
        0,
        10,
        30,
        30,
        15,
        0
      ],
      "expected_rainfall_depth_mm": 7.083333,
      "conduit_diameter_m": 0.6,
      "paired_baseline_case_id": "S1-REF-X050-D060",
      "changed_parameters": [
        "rainfall_intensity_mm_hr",
        "C1.circular_diameter_m"
      ]
    },
    {
      "case_id": "S1-REF-X050-D040",
      "rainfall_profile_id": "reference",
      "rainfall_depth_multiplier": 0.5,
      "rainfall_intensity_mm_hr": [
        0,
        10,
        30,
        30,
        15,
        0
      ],
      "expected_rainfall_depth_mm": 7.083333,
      "conduit_diameter_m": 0.4,
      "paired_baseline_case_id": "S1-REF-X050-D060",
      "changed_parameters": [
        "rainfall_intensity_mm_hr",
        "C1.circular_diameter_m"
      ]
    },
    {
      "case_id": "S1-REF-X050-D025",
      "rainfall_profile_id": "reference",
      "rainfall_depth_multiplier": 0.5,
      "rainfall_intensity_mm_hr": [
        0,
        10,
        30,
        30,
        15,
        0
      ],
      "expected_rainfall_depth_mm": 7.083333,
      "conduit_diameter_m": 0.25,
      "paired_baseline_case_id": "S1-REF-X050-D060",
      "changed_parameters": [
        "rainfall_intensity_mm_hr",
        "C1.circular_diameter_m"
      ]
    },
    {
      "case_id": "S1-REF-X100-D060",
      "rainfall_profile_id": "reference",
      "rainfall_depth_multiplier": 1,
      "rainfall_intensity_mm_hr": [
        0,
        20,
        60,
        60,
        30,
        0
      ],
      "expected_rainfall_depth_mm": 14.166667,
      "conduit_diameter_m": 0.6,
      "paired_baseline_case_id": "S1-REF-X100-D060",
      "changed_parameters": [
        "rainfall_intensity_mm_hr",
        "C1.circular_diameter_m"
      ]
    },
    {
      "case_id": "S1-REF-X100-D040",
      "rainfall_profile_id": "reference",
      "rainfall_depth_multiplier": 1,
      "rainfall_intensity_mm_hr": [
        0,
        20,
        60,
        60,
        30,
        0
      ],
      "expected_rainfall_depth_mm": 14.166667,
      "conduit_diameter_m": 0.4,
      "paired_baseline_case_id": "S1-REF-X100-D060",
      "changed_parameters": [
        "rainfall_intensity_mm_hr",
        "C1.circular_diameter_m"
      ]
    },
    {
      "case_id": "S1-REF-X100-D025",
      "rainfall_profile_id": "reference",
      "rainfall_depth_multiplier": 1,
      "rainfall_intensity_mm_hr": [
        0,
        20,
        60,
        60,
        30,
        0
      ],
      "expected_rainfall_depth_mm": 14.166667,
      "conduit_diameter_m": 0.25,
      "paired_baseline_case_id": "S1-REF-X100-D060",
      "changed_parameters": [
        "rainfall_intensity_mm_hr",
        "C1.circular_diameter_m"
      ]
    },
    {
      "case_id": "S1-REF-X150-D060",
      "rainfall_profile_id": "reference",
      "rainfall_depth_multiplier": 1.5,
      "rainfall_intensity_mm_hr": [
        0,
        30,
        90,
        90,
        45,
        0
      ],
      "expected_rainfall_depth_mm": 21.25,
      "conduit_diameter_m": 0.6,
      "paired_baseline_case_id": "S1-REF-X150-D060",
      "changed_parameters": [
        "rainfall_intensity_mm_hr",
        "C1.circular_diameter_m"
      ]
    },
    {
      "case_id": "S1-REF-X150-D040",
      "rainfall_profile_id": "reference",
      "rainfall_depth_multiplier": 1.5,
      "rainfall_intensity_mm_hr": [
        0,
        30,
        90,
        90,
        45,
        0
      ],
      "expected_rainfall_depth_mm": 21.25,
      "conduit_diameter_m": 0.4,
      "paired_baseline_case_id": "S1-REF-X150-D060",
      "changed_parameters": [
        "rainfall_intensity_mm_hr",
        "C1.circular_diameter_m"
      ]
    },
    {
      "case_id": "S1-REF-X150-D025",
      "rainfall_profile_id": "reference",
      "rainfall_depth_multiplier": 1.5,
      "rainfall_intensity_mm_hr": [
        0,
        30,
        90,
        90,
        45,
        0
      ],
      "expected_rainfall_depth_mm": 21.25,
      "conduit_diameter_m": 0.25,
      "paired_baseline_case_id": "S1-REF-X150-D060",
      "changed_parameters": [
        "rainfall_intensity_mm_hr",
        "C1.circular_diameter_m"
      ]
    },
    {
      "case_id": "S1-SHORT-X050-D060",
      "rainfall_profile_id": "short_burst",
      "rainfall_depth_multiplier": 0.5,
      "rainfall_intensity_mm_hr": [
        0,
        0,
        42.5,
        42.5,
        0,
        0
      ],
      "expected_rainfall_depth_mm": 7.083333,
      "conduit_diameter_m": 0.6,
      "paired_baseline_case_id": "S1-SHORT-X050-D060",
      "changed_parameters": [
        "rainfall_intensity_mm_hr",
        "C1.circular_diameter_m"
      ]
    },
    {
      "case_id": "S1-SHORT-X050-D040",
      "rainfall_profile_id": "short_burst",
      "rainfall_depth_multiplier": 0.5,
      "rainfall_intensity_mm_hr": [
        0,
        0,
        42.5,
        42.5,
        0,
        0
      ],
      "expected_rainfall_depth_mm": 7.083333,
      "conduit_diameter_m": 0.4,
      "paired_baseline_case_id": "S1-SHORT-X050-D060",
      "changed_parameters": [
        "rainfall_intensity_mm_hr",
        "C1.circular_diameter_m"
      ]
    },
    {
      "case_id": "S1-SHORT-X050-D025",
      "rainfall_profile_id": "short_burst",
      "rainfall_depth_multiplier": 0.5,
      "rainfall_intensity_mm_hr": [
        0,
        0,
        42.5,
        42.5,
        0,
        0
      ],
      "expected_rainfall_depth_mm": 7.083333,
      "conduit_diameter_m": 0.25,
      "paired_baseline_case_id": "S1-SHORT-X050-D060",
      "changed_parameters": [
        "rainfall_intensity_mm_hr",
        "C1.circular_diameter_m"
      ]
    },
    {
      "case_id": "S1-SHORT-X100-D060",
      "rainfall_profile_id": "short_burst",
      "rainfall_depth_multiplier": 1,
      "rainfall_intensity_mm_hr": [
        0,
        0,
        85,
        85,
        0,
        0
      ],
      "expected_rainfall_depth_mm": 14.166667,
      "conduit_diameter_m": 0.6,
      "paired_baseline_case_id": "S1-SHORT-X100-D060",
      "changed_parameters": [
        "rainfall_intensity_mm_hr",
        "C1.circular_diameter_m"
      ]
    },
    {
      "case_id": "S1-SHORT-X100-D040",
      "rainfall_profile_id": "short_burst",
      "rainfall_depth_multiplier": 1,
      "rainfall_intensity_mm_hr": [
        0,
        0,
        85,
        85,
        0,
        0
      ],
      "expected_rainfall_depth_mm": 14.166667,
      "conduit_diameter_m": 0.4,
      "paired_baseline_case_id": "S1-SHORT-X100-D060",
      "changed_parameters": [
        "rainfall_intensity_mm_hr",
        "C1.circular_diameter_m"
      ]
    },
    {
      "case_id": "S1-SHORT-X100-D025",
      "rainfall_profile_id": "short_burst",
      "rainfall_depth_multiplier": 1,
      "rainfall_intensity_mm_hr": [
        0,
        0,
        85,
        85,
        0,
        0
      ],
      "expected_rainfall_depth_mm": 14.166667,
      "conduit_diameter_m": 0.25,
      "paired_baseline_case_id": "S1-SHORT-X100-D060",
      "changed_parameters": [